<?xml version="1.0" encoding="UTF-8"?>
<?xml-stylesheet type="text/xsl" href="sarmiento_transform.xsl"?>
<studentPortfolio xmlns:xsi="http://www.w3.org/2001/XMLSchema-instance"
                  xsi:noNamespaceSchemaLocation="sarmiento_schema.xsd">

    <student>
        <name>
            <firstName> Sandara</firstName>
            <secondName>Nicole</secondName>
            <middlename>Bonifacio</middlename>
            <lastName>Sarmiento </lastName>
        </name>

        <studentNumber> 2022300234</studentNumber>
        <studentEmail> sn.sarmiento00235@student.tsu.edu.ph</studentEmail>

        <course>
            <program> Bachelor of Science in Information Technology</program>
            <major> Web and Mobile Application</major>
            <year> 4th Year</year>
            <section> WMA-4A</section>
        </course>

        <achievements>
            <cert> Software Development Life Cycle &amp; 1 Certificate</cert>
            <cert> Basic Cisco Networking &amp; 1 Certificate</cert>
            <cert> Introduction to Linux &amp; 1 Certificate</cert>
            <award> Dean's Lister since 1st year &amp; CCS</award>
            <award> Girls Basketball MVP Intramurals 2023</award>
        </achievements>

        <hobbies>
            <hobby> Reading Books</hobby>
            <hobby> Music Streaming</hobby>
            <hobby> Netflix Streaming</hobby>
            <hobby> Studying</hobby>
        </hobbies>

    </student>

</studentPortfolio>
